Tweet;tidy_text;sentimen
Inilah bentuk kualitas yang akan mengawasi pemilu rakyat bisa menilai wahai pengawas dengan siapa kalian berpihak dengan siapa kalian culas dan menegakkan aturan;ini bentuk kualitas awas milu rakyat nilai wahai awas siapa kalian pihak siapa kalian culas tegak atur;-1
;;
;;
;;
;;
;;
;;
;;
;;
;;
;;
;;
;;
;;
;;
Apanpun komentar netizen silakan Klo aku sih udah pasti berubah di pemilu Awal dukung ganjar skrg emoh PDIP jg gak akan kupilih Udah itu aja;apanpun komentar netizen sila udah ubah milu awal dukung ganjar skrg emoh pdip pilih udah;-1
;;
Kalau gitu kita dorong berpasangan dengan didukung oleh Partai Perjuangan Koalisi besar PASUKAN KADRUN yang akan memenangkan Pemilu Cc Ind;kalau gitu dorong pasang dukung partai juang koalisi besar pasu kadrun menang milu;-1
Anggota Bawaslu Boltim Ikal Salehe hadir dalam Diskusi Kelompok Terpumpun Evaluasi dan Tindaklanjut Hasil Pemetaan Kerawanan Dalam Indeks Kerawanan Pemilu dan Pemilihan Serentak di Prov Sulut yang diselenggarakan Puslitbangdiklat Bawaslu RI;anggota bawaslu boltim ikal salehe hadir diskusi kelompok pumpun evaluasi tindaklanjut hasil meta rawan indeks rawan milu pilih serentak prov sulut selenggara puslitbangdiklat bawaslu;1
Partai kontol harus dihukum pads PEMILU;partai kontol hukum pads milu;-1
;;
;;
;;
;;
;;
Karena itu walau posisi mereka nyaris tidak akan tergeser sampai Pemilu nanti para capres tersebut butuh cawapres yang tepat Ridwan Kamil;posisi nyaris geser milu capres sebut butuh cawapres tepat ridwan kamil;-1
;;
;;
Jd terang benderang buruknya cara kerja Bawaslu yg berpihak idealnya kan hrs netral Andai petahana menang lg di Pemilu PASTI ketua Bawaslu nya akan dijatah jabatan basah Ancooor ee;terang benderang buruk cara kerja bawaslu pihak ideal netral andai tahana menang milu ketua bawaslu jatah jabat basah ancooor;-1
AHY Menjadi semangat kader untuk sukseskan dan menangkan Pemilu;jadi semangat kader sukses menang milu;1
Komunitas Pemilu Bersih Mengawal dan Memastikan Pemilu Serentak Bersih;komunitas milu bersih awal pasti milu serentak bersih;1
Jakarta Ketua Lembaga Masyarakat Adat LMA Tanah Papua yang juga Staf Ahli Kantor Staf Presiden Bidang Politik dan Keamanan Lenis Kogoya mengatakan warga adat Papua terbuka untuk mendukung Prabowo Subianto sebagai calon presiden capres dalam pemilu;jakarta ketua lembaga masyarakat adat tanah papua staf ahli kantor staf presiden bidang politik aman lenis kogoya kata warga adat papua buka dukung prabowo subianto calon presiden capres milu;1
;;
;;
;;
Yang PENTING PEMILU;penting milu;1
;;
ga usah terlalu berharap pemilu berjalan jujur dan adil;usah terlalu harap milu jalan jujur adil;-1
Anggota Bawaslu Kabupaten Bolaang Mongondow Timur Ikal Salehe SKep Mengikuti Rapat Koordinasi dan Evaluasi Pelaksanaan Pengawasan Sub Tahapan Pencocokan dan Penelitian Daftar Pemilih Pemilu Tahun di Provinsi Sulawesi Utara;anggota bawaslu kabupaten bolaang mongondow timur ikal salehe skep ikut rapat koordinasi evaluasi laksana awas tahap cocok teliti daftar pilih milu tahun provinsi sulawesi utara;1
Semoga lolos menjadi peserra pemilu;moga lolos jadi peserra milu;1
;;
;;
Bivitri Susanti Tolak Penundaan Pemilu Karena Mengundur Pemilu Sama Dengan Merusak Konstitusi Dan Menciderai Demokrasi;bivitri susanti tolak tunda milu undur milu sama rusak konstitusi menciderai demokrasi;-1
Mohon dibentuk juga bawaslu perubahan untuk mengawal suara dan pemilu jurdil Presiden buat kisi capres BIN ikut politik menteri pada gila pragmatis dll kayaknya pemilu ini akan penuh dengan kecurangan;mohon bentuk bawaslu ubah awal suara milu jurdil presiden buat kisi capres ikut politik menteri gila pragmatis kayak milu penuh curang;1
Tidak percaya lagi hasil pemilu;percaya hasil milu;-1
;;
Jelang Pemilu PAN Siapa Pun Capresnya Erick Thohir Cawapresnya;jelang milu siapa capresnya erick thohir cawapresnya;-1
Andika dalam sambutannya menyampaikan dari kegiatan Sosialisasi Partai Politik ini diharapkan adanya partisipasi aktif peserta dalam forum diskusi dalam mensukseskan Pemilu serta tercapainya sinkronisasi data Kemenkumham Jabar RAndika Dwi Prasetya;andika sambut sampai giat sosialisasi partai politik harap ada partisipasi aktif serta forum diskusi sukses milu capa sinkronisasi data kemenkumham jabar randika prasetya;1
Repost dari Ketua Harian Nasional Partai Perindo Dr TGB Muhammad Zainul Majdi optimistis target dua digit bisa tercapai di Pemilu;repost ketua hari nasional partai perindo muhammad zainul majdi optimistis target digit capai milu;1
Anggota KPU Kalbar Mujiyo menjadi keynote speaker dalam Sosialisasi PKPU Tahun tentang Daerah Pemilihan dan Alokasi Kursi Anggota DPR DPRD Provinsi dan DPRD KabupatenKota dalam Pemilu Tahun yang dilaksanakan oleh KPU Kabupaten Sintang Senin;anggota kalbar mujiyo jadi keynote speaker sosialisasi pkpu tahun daerah pilih alokasi kursi anggota dprd provinsi dprd kabupatenkota milu tahun laksana kabupaten sintang senin;1
KPU Kabupaten Bolmut bersama kabupatenkota menghadiri Rapat Koordinasi persiapan penyusunan DPS untuk Pemilu Tahun;kabupaten bolmut sama kabupatenkota hadir rapat koordinasi siap susun milu tahun;1
Bawaslu nya aja kayak begini yakin pemilu bakal jujur amp adil;bawaslu kayak begini yakin milu bakal jujur adil;-1
KPU dan Bawaslu Kabupaten Magelang Sosialisasi Daerah Pemilihan dan Alokasi Kursi Pemilu;bawaslu kabupaten magelang sosialisasi daerah pilih alokasi kursi milu;-1
;;
;;
Berikut ini adalah Daerah Pemilihan Dapil dan Jumlah Kursi Anggota DPRD Kabupaten Gorontalo pada Pemilu Serentak Tahun;ikut daerah pilih dapil jumlah kursi anggota dprd kabupaten gorontalo milu serentak tahun;1
PSSI ganti job aja bantuin persiapan pemilu;pssi ganti bantuin siap milu;-1
Harapan Demokrat untuk pemilu;harap demokrat milu;1
TAAAAAAAEEEEEEEEEEEE BERAK SEKEBON FIX PEMILU KELOMPOK MEREKA LAGI YG MENANG WKWKWKWKWKWKW TOLOL BANGSAT;taaaaaaaeeeeeeeeeeee berak kebon milu kelompok menang wkwkwkwkwkwkw tolol bangsat;-1
;;
Bawaslu soal Putusan Gugatan Partai PRIMA Sebut Tak Akan Ganggu Tahapan Pemilu;bawaslu soal putus gugat partai prima sebut ganggu tahap milu;-1
Perjuangan Sy tmbhkan narasinya Siapa yg blg taat regulasi pemilu siapa yg gembor politik identitas siapa yg blg Masjid jgn djdikan tempat transaksi politik Siapa yg melanggar semua bacot itu Mmg cocok dgn ide perubahan total itu semua hanya bacot RI Perjuangan;juang tmbhkan narasi siapa taat regulasi milu siapa gembor politik identitas siapa masjid djdikan tempat transaksi politik siapa langgar semua bacot cocok ubah total semua bacot juang;-1
Rabu Feb Koordinasi dan Sinergitas antara Penyelenggara amp Pengawas Pemilu pada Pemilu Serentak;rabu koordinasi sinergitas selenggara awas milu milu serentak;1
Setelah kemarin mengesahkan Perppu Ciptakerja yg melanggar konstitusi kini RI rapat dengan RI ingin melanggar konstitusi untuk ke kalinyaGILA DPR Rapat Bareng KPUBawaslu Bahas Putusan Tunda Pemilu;kemarin kesah perppu ciptakerja langgar konstitusi kini rapat langgar konstitusi kalinyagila rapat bareng kpubawaslu bahas putus tunda milu;-1
Jelang Pemilu Mahasiswa Diajak Sisir Konten yang Beredar di Masyarakat;jelang milu mahasiswa ajak sisir konten edar masyarakat;1
KIB Memiliki visi membangun Indonesia dalam tahun kedepan;milik visi bangun indonesia tahun depan;1
Pemilu tetap berjalan sesuai dengan tahapan Hal ini sesuai dengan amanat konstitusi Mari kita bersama jaga pelaksanaan Pemilu agar Pemilu berlangsung sesuai konstitusi;milu tetap jalan sesuai tahap sesuai amanat konstitusi sama jaga laksana milu milu langsung sesuai konstitusi;1
Presiden harus melihat video ini sebagai bahan refleksi dalam sengkarut penundaan Pemilu;presiden lihat video bahan refleksi sengkarut tunda milu;1
Babinsa Koramil Karanganyar Bersama personel Polsek Karanganyar melaksanakan Komsos dengan Linmas Desa Wonorejo sebagai upaya dan kesiapan Linmas dalam menyikapi tahun Politik Pemilu;babinsa koramil karanganyar sama personel polsek karanganyar laksana komsos linmas desa wonorejo upaya kesiap linmas sikap tahun politik milu;1
Sekda Siak Teken MoU Komitmen Besama Sukseskan Pemilu Serentak;sekda siak teken komitmen besama sukses milu serentak;1
Kl gtu  USAH PAKE pemilu umumin aj langsung pres dan wapres RI;usah pake milu umumin langsung pres wapres;-1
Anies selalu diwanti Bawaslu meskipun gak ada aturan KPU yang dilanggar karena Anies belum ditetapkan sebagai calon presiden oleh KPU Sedangkan PDIP udah ditetapkan sebagai partai peserta Pemilu Bawaslu mustinya lebih tegas terhadap pembagian amplop berlogo PDIP;anies selalu diwanti bawaslu meski atur langgar anies tetap calon presiden pdip udah tetap partai serta milu bawaslu mustinya lebih tegas bagi amplop logo pdip;-1
DPR Rapat Bareng KPUBawaslu Bahas Putusan Tunda Pemilu;rapat bareng kpubawaslu bahas putus tunda milu;-1
Halo Sobat Milennial dan Gen  kamu bisa akses untuk cari informasi seputar pemilu Kamu bisa juga kasih pertanyaan yang akan dijawab oleh redaksi Jangan lupa juga tonton talkshow seputar pemilu di sosial media;halo sobat milennial kamu akses cari informasi putar milu kamu kasih tanya jawab redaksi jangan lupa tonton talkshow putar milu sosial media;1
Manuver Airlangga Hartarto Naikkan Posisi Tawar Partai Golkar di Pemilu;manuver airlangga hartarto naik posisi tawar partai golkar milu;1
PEMILU PKB Tembus Besar di Survei Kiai Maman Bakar Semangat Kader di Dapil MajalengkaSubangSubang;milu tembus besar survei kiai maman bakar semangat kader dapil majalengkasubangsubang;1
DPR Bakal Banyak Parpol yang Tak Lolos Peserta Pemilu Tiru Cara Partai Prima;bakal banyak parpol lolos serta milu tiru cara partai prima;1
chotimah Jokowi melakukan dg diam dan kita juga belum tahu apa syaratnya tp kalau penolakan dilakukan secara vulgar dan itu jadi salah satu puncak pembatalan Indonesia jadi tuan rumah maka telunjuk ini pasti tertuju pada orang yg akan butuh bantuan suara orang lain pada pemilu;chotimah jokowi laku diam tahu syarat kalau tolak laku vulgar jadi salah satu puncak batal indonesia jadi tuan rumah telunjuk tuju orang butuh bantu suara orang milu;1
Gus Muhaimin Optimistis PKB Ukir Sejarah Baru di Pemilu;muhaimin optimistis ukir sejarah baru milu;1
Pemilih KPU Kabupaten Bengkayang melaksanakan Serah Terima Kirab Pemilu Tahun kepada KPU Kabupaten Landak bertempat di halaman kantor KPU Kabupaten Landak Senin Serah terima ini merupakan rangkaian dari kegiatan Kirab Pemilu Tahun yang;pilih kabupaten bengkayang laksana serah terima kirab milu tahun kabupaten landak tempat halaman kantor kabupaten landak senin serah terima rupa rangkai giat kirab milu tahun;1
Gawat ini pemilu diprediksi lbh parah dari Penyelenggara pemilu udah teranggan berpihak pada kekuasaan;gawat milu prediksi parah selenggara milu udah anggan pihak kuasa;-1
Mari kita bersama jaga pelaksanaan Pemilu terutama dari upaya mengganggu rencana gugatan dari Komisi Pemilihan Umum agar Pemilu berlangsung sesuai konstitusi;sama jaga laksana milu utama upaya ganggu rencana gugat komisi pilih umum milu langsung sesuai konstitusi;1
Pemilu tetap berjalan sesuai dengan tahapan Hal ini sesuai dengan amanat konstitusi;milu tetap jalan sesuai tahap sesuai amanat konstitusi;1
Hilal pemilu sudah muncul Salah satu org yg kelakuan nya harus diarsipkan;hilal milu muncul salah satu laku arsip;1
Tapikan yang penting PEMILU tetap;tapi penting milu tetap;1
Bersama Ketua DPW Perindo NTT Jonathan Nubatonis TGB Muhammad Zainul Majdi Ketua Harian Nasional DPP Partai Perindo Bicara tentang target perolehan kursi dan kriteria calon Presiden pada Pemilu serta menentang dan melawan politik identitas;sama ketua perindo jonathan nubatonis muhammad zainul majdi ketua hari nasional partai perindo bicara target oleh kursi kriteria calon presiden milu tentang lawan politik identitas;-1
Bawaslu sdh mulai mencret tanda pemilu akan penuh kecurangan Mengapa bawaslu itu nggak dibuat independen ketuanya kolegial perwakilan dari partai politik di setujui DPR Nggak usah ada campur tangan penguasa;bawaslu mulai mencret tanda milu penuh curang bawaslu buat independen ketua kolegial wakil partai politik tuju usah campur tangan kuasa;-1
Namun di tengah rapat Arteria meminta penjelasan kepada Plt Deputi Analisa dan Pemeriksaan Pak Danang Ia meminta PPATK menunjukkan akuntabilitasnya terkait temuan tersebut soal dugaan aliran dana Rp triliun yang mengalir ke partai politik untuk persiapan Pemilu;tengah rapat arteria minta jelas deputi analisa periksa danang minta ppatk tunjuk akuntabilitas kait temu sebut soal duga alir dana triliun alir partai politik siap milu;1
Komunitas Pemilu Bersih Mengawal dan Memastikan Pemilu Serentak Bersih;komunitas milu bersih awal pasti milu serentak bersih;1
DPR Bakal Banyak Parpol yang Tak Lolos Peserta Pemilu Tiru Cara Partai Prima;bakal banyak parpol lolos serta milu tiru cara partai prima;-1
;;
Mari kita bersama jaga pelaksanaan Pemilu;sama jaga laksana milu;1
Bawaslu Tegaskan Putusan Gugatan Prima Tak akan Ganggu Tahapan Pemilu;bawaslu tegas putus gugat prima ganggu tahap milu;1
Konsultasi Pengelolaan Media Sosial sebagai Media Sosialisasi Pendidikan Pemilih pada Pemilu Februari;konsultasi kelola media sosial media sosialisasi didik pilih milu februari;1
Alasan kenapa elektabilitas seperti ini hasilnya Ganjar stagnan sebab sampai saat ini tidak ada partai yg mengusung Prabowo naik sebab partai gerindra berada di urutan ke dan berpeluang besar mendapatkan koalisi untuk mendaftarkan pemilu;alas elektabilitas hasil ganjar stagnan partai usung prabowo naik partai gerindra ada urut peluang besar dapat koalisi daftar milu;1
telah lakukan tugasnya dan telah bersedia laksanakan putusannyaIni bermakna Partai yang sama dgn Prima mempunyai hak yang sama Apa tdk sebaiknya Prima RepublikPKP dan Parsindo diputuskan untuk ikut Pemilu Biarkanlah Rakyat yang menseleksiinilah demokrasi;laku tugas sedia laksana putusannyaini makna partai sama prima punya sama baik prima republikpkp parsindo putus ikut milu biar rakyat menseleksiinilah demokrasi;1
DPR Khawatir Putusan PN Jakpus dan Bawaslu soal Partai Prima Bisa Ganggu Tahapan Pemilu;khawatir putus jakpus bawaslu soal partai prima ganggu tahap milu;-1
Partai Republik punya hak yang sama dengan Partai yang lain membangun demokrasi untuk menjayakan NKRI terus berjuang dengan caracara konstitusional Insya Allah lolos menjadi Partai Peserta Pemilu;partai republik punya sama partai bangun demokrasi jaya nkri terus juang caracara konstitusional insya allah lolos jadi partai serta milu;1
Ketua DPC PDI Perjuangan  Made Cahyana Negara mengatakan PDI Perjuangan Banyuwangi target meraih kursi DPRD Banyuwangi atau separuh dari kursi di parlemen pada pemilu;ketua juang made cahyana negara kata juang banyuwangi target raih kursi dprd banyuwangi paruh kursi parlemen milu;1
PDI Perjuangan Gandeng Milenial Banyuwangi Menangkan Pemilu Gaet Milenial PDI Perjuangan Banyuwangi ingin mewujudkan target menang quattrick di Pemilu PDI Perjuangan sebelumnya telah mewujudkan menang hattrick pada pemilu;juang gandeng milenial banyuwangi menang milu gaet milenial juang banyuwangi wujud target menang quattrick milu juang belum wujud menang hattrick milu;1
Pemilu Mantan Bawaslu Jateng Tetap Pilih Proporsional Terbuka;milu mantan bawaslu jateng tetap pilih proporsional buka;1
Sejumlah nama masuk dalam jajaran tokoh yang memiliki elektabilitas paling tinggi untuk maju sebagai calon wakil presiden cawapres pada Pemilu;jumlah nama masuk jajar tokoh milik elektabilitas paling tinggi maju calon wakil presiden cawapres milu;1
Hasil survei nasional Indikator Politik Indonesia ditelaah melalui persepsi media massa Praktisi media Retno Pinasti membeberkan dinamika elektabilitas tokoh yang muncul di bursa calon wakil presiden cawapres;hasil survei nasional indikator politik indonesia telaah lalu persepsi media massa praktisi media retno pasti beber dinamika elektabilitas tokoh muncul bursa calon wakil presiden cawapres;1
Tandai partai dan ormasnya di pemilu;tanda partai ormasnya milu;-1
Bawaslu meminta agar partai politik tidak berkampanye menggunakaan politisasi SARA maupun politisasi agama;bawaslu minta partai politik kampanye menggunakaan politisasi sara maupun politisasi agama;1
Mari Bersama Jaga pemilu Tetap damai;sama jaga milu tetap damai;1
PENGADILAN NEGERI DILEMA PEMILU DITUNDA Pengadilan Negeri atau PN Jakarta Pusat mengetok palu Pemilu ditunda hingga Keputusan tersebut tertuang dalam putusan perdata yang diajukan Partai Prima dengan tergugat Komisi Pemilihan Umum;adil negeri dilema milu tunda adil negeri jakarta pusat ketok palu milu tunda hingga putus sebut tuang putus perdata aju partai prima gugat komisi pilih umum;1
tolak partai politik yang berkampanye menggunakaan politisasi SARA maupun politisasi agama;tolak partai politik kampanye menggunakaan politisasi sara maupun politisasi agama;1
Jelang Pemilu Bawaslu mewantiwanti partai politik agar tidak berkampanye menggunakaan politisasi SARA maupun politisasi agama;jelang milu bawaslu mewantiwanti partai politik kampanye menggunakaan politisasi sara maupun politisasi agama;1
Jelang Pemilu Mahasiswa Wajib Hindari Politik Praktis via Papua;jelang milu mahasiswa wajib hindar politik praktis papua;1
DPR Bakal Banyak Parpol yang Tak Lolos Peserta Pemilu Tiru Cara Partai Prima;bakal banyak parpol lolos serta milu tiru cara partai prima;1
Para Tokoh Agama Deklarasikan Pemilu Damai Tanpa Politisasi Agama;tokoh agama deklarasi milu damai politisasi agama;1
warga adat Papua terbuka untuk mendukung Prabowo Subianto sebagai calon presiden capres dalam pemilu Prabowo Subianto;warga adat papua buka dukung prabowo subianto calon presiden capres milu prabowo subianto;1
Pemilu tetap berjalan sesuai dengan tahapan Hal ini sesuai dengan amanat konstitusi;milu tetap jalan sesuai tahap sesuai amanat konstitusi;1
;;
Sikap partai mu gmn den Lolos gak utk ikiut pemilu;sikap partai lolos ikiut milu;1
Diduga Menerima Uang Ketua KPU Kab Jayapura Diperiksa DKPP;duga terima uang ketua jayapura periksa dkpp;-1
Hadapi Pemilu BSPND Jawa Barat Gelar Rakornis seJawa Barat;hadap milu bspnd jawa barat gelar rakornis sejawa barat;1
Senin Maret Komisioner Panwascam Mengikuti Kegiatan Rapat Fasilitasi dan Pembinaan Penanganan Pelanggaran Pada Tahapan Rekapitulasi Daftar Pemilih Hasil Pemutakhiran Data Pemilu Serentak Tahun yang diselenggarakan oleh Bawaslu Kabupaten Ciamis;senin maret komisioner panwascam ikut giat rapat fasilitas bina tangan langgar tahap rekapitulasi daftar pilih hasil mutakhir data milu serentak tahun selenggara bawaslu kabupaten ciamis;1
;;
Agenda Kirab Pemilu Dapil Mitra Cuma Lewat;agenda kirab milu dapil mitra cuma lewat;-1
Terkesan Pilih Kasih Kirab Pemilu KPU Mitra Tuai Sorotan;kes pilih kasih kirab milu mitra tuai sorot;-1
Gubernur Jawa Barat Ridwan Kamil meminta babinsa bhabinkamtibmas dan lurahkades menyatukan persepsi agar situasi wilayahnya tetap harmonis humanis dan kondusif menjelang Pemilu;gubernur jawa barat ridwan kamil minta babinsa bhabinkamtibmas lurahkades satu persepsi situasi wilayah tetap harmonis humanis kondusif jelang milu;1
Hadapi Pemilu BSPN DPC PDI Perjuangan Garut Latih Puluhan Pelatih Saksi;hadap milu bspn juang garut latih puluh latih saksi;1
Kader Banteng Cimahi Siap Menangkan Pemilu;kader banteng cimahi siap menang milu;1
Pemilihan Umum Pemilu tahun diharapkan berlangsung dengan kondusif dan melahirkan pemimpin yang sesuai dengan keinginan dan kebutuhan masyarakat;pilih umum milu tahun harap langsung kondusif lahir pimpin sesuai ingin butuh masyarakat;1
Alasannya sudah jelas pemilu Dipikir kami penggemar bola mau ikutan;alas jelas milu pikir gemar bola ikut;-1
mau heran tapi bentar lagi pemilu;heran bentar milu;-1
Simak ini yuk Repost Ikuti dan saksikan Kirab Pemilu sebagai bentuk sosialisasi dan pemilih yang membawa perjalanan estafet benderan Partai Politik peserta Pemilu bertajuk Pemilu sebagai;simak repost ikut saksi kirab milu bentuk sosialisasi pilih bawa jalan estafet benderan partai politik serta milu tajuk milu;1
Partai Golkar menghendaki kemenangan dalam Pemilu;partai golkar hendak menang milu;1
Sebelumnya Bawaslu memerintahkan KPU melakukan verifikasi administrasi perbaikan terhadap Prima sebagai partai politik calon peserta Pemilu;belum bawaslu perintah laku verifikasi administrasi baik prima partai politik calon serta milu;1
Surabaya Betul itu Pak Dan jangan lupa HonorGaji para PANTARLIH MOHON SEGERA DICAIRKAN Sudah lama mereka menantikan Honor mereka termasuk saya Tolong hargai Pak jerih payah para PANTARLIH yg telah sukses mendata calon pemilih pemilu;surabaya betul jangan lupa honorgaji pantarlih mohon segera cair lama nanti honor masuk harga jerih payah pantarlih sukses data calon pilih milu;1
;;
ya tuhan padahal aku mau memulai dengan topik pemilu;tuhan padahal mulai topik milu;-1
Bivitri Susanti Tolak Penundaan Pemilu Karena Mengundur Pemilu Sama Dengan Merusak Konstitusi Dan Menciderai Demokrasi;bivitri susanti tolak tunda milu undur milu sama rusak konstitusi menciderai demokrasi;-1
;;
Spanduk Golput di Kota Malang Ancaman Nyata Pemilu;spanduk golput kota malang ancam nyata milu;-1
Ketua DKPP Putusan Bawaslu Erga Omnes;ketua dkpp putus bawaslu erga omnes;-1
Tolak keras politik identitas jelang pemilu;tolak keras politik identitas jelang milu;1
Politik identitas hanya memecah belah persatuan;politik identitas pecah belah satu;1
Tolak politisasi SARA;tolak politisasi sara;1
Hentikan kampanye politik identitas;henti kampanye politik identitas;1
Tolak politik identitas jelang pemilu;tolak politik identitas jelang milu;1
;;
Demi kepentingan pemilu menarik perhatian kaum muslimin gini amat Gimana mau maju nih bangsa;penting milu tarik perhati kaum muslimin gin gimana maju bangsa;-1
Pak Ketum hrt Buka Bersama di DPP Nasdem nih;tum buka sama nasdem;1
Mari samasama tangkal politisasi SARA;samasama tangkal politisasi sara;1
;;
Politik identitas dan SARA bisa memicu gejolak;politik identitas sara picu gejolak;1
Tolak politik SARA yang bisa merusak persatuan bangsa;tolak politik sara rusak satu bangsa;1
Hentikan isu SARA dalam kampanye politik;henti sara kampanye politik;1
Harapannya diskusi ini tentunya memberikan pemahaman dan mengikat komitmen bersama untuk menyukseskan pemilu khususnya di Aceh pungkas Isa Kemenkumham Aceh;harap diskusi tentu beri paham ikat komitmen sama sukses milu khusus aceh pungkas kemenkumham aceh;1
Pemilu aman dan damai tanpa politik identitas;milu aman damai politik identitas;1
Menurut Rakhmat parpol harus memberikan pendidikan politik kepada masyarakat agar menjadikan Pemilu nanti menjadi wadah penyaluran hak politik dengan baik Kemenkumham Aceh;rakhmat parpol beri didik politik masyarakat jadi milu jadi wadah salur politik baik kemenkumham aceh;1
SUKSESKAN PEMILU KANWIL KEMENKUMHAM ACEH AJAK PARPOL DI ACEH JUJUR DAN ADIL;sukses milu kanwil kemenkumham aceh ajak parpol aceh jujur adil;1
Menolak pejabat yang cari muka demi mendapat dukungan dari golongan tertentu menuju pemilu;tolak jabat cari muka dapat dukung golong tentu tuju milu;1
Tolak politik identitas dan SARA jelang pemilu;tolak politik identitas sara jelang milu;1
Politik identitas dan SARA dapat memecah belah persatuan;politik identitas sara pecah belah satu;1
DPR Rapat Bareng KPUBawaslu Bahas Putusan Tunda Pemilu Rasanya blom pernah terjadi di rezim sblmnya;rapat bareng kpubawaslu bahas putus tunda milu rasa blom pernah jadi rezim sblmnya;1
Cegah politik identitas;cegah politik identitas;1
Ciptakan politik yang aman dan sejuk;cipta politik aman sejuk;1
Tolak politik SARA jelang pemilu;tolak politik sara jelang milu;1
Wah kalo beneran SUPOERTER MANIA BOLA SELURUH KONOHA bisa marah kmudian bersatu Tenggelamkan di pemilu mendatang dan tolak jadi caprescawapres di BISA RAME NIH BUNTUTNYA;kalo beneran supoerter mania bola seluruh konoha marah kmudian satu tenggelam milu datang tolak jadi caprescawapres rame buntut;-1
RI Terlalu vulgar bawaslu keberpihakannya tdk netral tdk adil akan jd catatan dalam sejarah bawaslu pemilu tdk profesional jd wasit;terlalu vulgar bawaslu pihak netral adil catat sejarah bawaslu milu profesional wasit;-1
Indonesia negara Pancasila yang berdiri diantara keanekaragaman bangsanya Jelang Pemilu Bawaslu mewantiwanti partai politik;indonesia negara pancasila diri antara keanekaragaman bangsa jelang milu bawaslu mewantiwanti partai politik;1
Ga heran pemilu soalnya jadi banyak yg kosplei pahlawan kesiangan;heran milu soal jadi banyak kosplei pahlawan siang;-1
Semoga partai republik bisa mengikuti pemilu serentak tahun;moga partai republik ikut milu serentak tahun;1
Lembaga survei Indikator Politik Indonesia merilis hasil survei elektabilitas Calon Wakil Presiden Cawapres jelang Pemilu;lembaga survei indikator politik indonesia rilis hasil survei elektabilitas calon wakil presiden cawapres jelang milu;1
Anggota DPR Fraksi PDI Perjuangan Said Abdullah membantah amplop isi uang yang dibagikan di masjid tersebut dalam rangka kampanye Pemilu Ia juga mengatakan kegiatan itu sudah menjadi rutinitasnya karena bagian dari menjalankan rukun islam yaitu zakat mal;anggota fraksi juang said abdullah ban amplop uang bagi masjid sebut rangka kampanye milu kata giat jadi rutinitasnya bagi jalan rukun islam zakat;-1
Yg di daftar itu jgn dipilih di pemilu;daftar pilih milu;-1
Jika benar lupakan mereka di pemilu;benar lupa milu;-1
Terbitkan Tiga Pengumuman Berbeda DKPP Periksa KPU Musi Banyuasin;terbit tiga umum beda dkpp periksa mus banyuasin;1
Bye PDIP Sejak pertama bisa ikut pemilu selalu coblos PDIP BIG NO;pdip sejak pertama ikut milu selalu coblos pdip;-1
jangan sampe parpol make politisasi SARA dan identitas jelang pemilu;jangan sampe parpol make politisasi sara identitas jelang milu;1
hentikan isu sara jelang pemilu;henti sara jelang milu;1
Lagilagi babu rakyat partai banteng coret aja partai banteng dari pemilu karena gabisa menghasilkan babubabu rakyat yg berkualitas;lagilagi babu rakyat partai banteng coret partai banteng milu gabisa hasil babubabu rakyat kualitas;-1
