Tweet;tidy_text;sentimen
Menyejukkan luar biasa tapi bagi pembenci Anies Baswedan ini adalah pukulan telak atas mereka yg ingin menjegal Anies Baswedan maju di pilpres insyaallah pak Anies kami rakyat butuh anda untuk membawa perubahan di negeri ini salam dari Berau Kaltim;sejuk luar biasa benci anies baswedan pukul telak atas jegal anies baswedan maju pilpres insyaallah anies rakyat butuh bawa ubah negeri salam rau kaltim;-1
Repost dari Kebakaran terjadi di Gang Lapo Sona Kelurahan Baringin Kota Sibolga Sumatera Utara;repost bakar jadi gang lapo sona lurah baringin kota sibolga sumatera utara;-1
Kasihan Kadrun yah partai nya sudah mau tahun engga dapet jabatan Menteri makanya kadrun sangat menderitananti kadrun kalah lagi Pilpres menderita lagi tahun partai nya kadrun engga dapet jabatan Menteri Hahaha;kasihan kadrun partai tahun engga dapet jabat menteri makanya kadrun sangat menderitananti kadrun kalah pilpres derita tahun partai kadrun engga dapet jabat menteri hahaha;-1
Repost dari Bantuan gerobak gratis dari Partai Perindo berdampak langsung meningkatkan perekonomian warga;repost bantu gerobak gratis partai perindo dampak langsung tingkat ekonomi warga;1
wy Pemimpin Muda Inovatif dan Kreatif di dukung penuh generasi milenial Pemimpin muda yang punya banyak ide dan inovasi dalam memajukan daerah Suara semesta mendukung Cak Fauzi Calon Gubernur Jawa Timur di Pilpres;pimpin muda inovatif kreatif dukung penuh generasi milenial pimpin muda punya banyak inovasi maju daerah suara semesta dukung fauzi calon gubernur jawa timur pilpres;1
Simpatisan Jokowi di Ponorogo mendeklarasikan dukungan untuk Prabowo Subianto pada Pilpres Gerindra yakin nanti Prabowo menang di Ponorogo;simpatisan jokowi ponorogo deklarasi dukung prabowo subianto pilpres gerindra yakin prabowo menang ponorogo;1
Dulu WORLD surveyjika pilpres dilakukan sekarang maka pemenangnyaAnies Baswedan Itu dulu bbrp bulan yllSekarang atau besok pun SAMA;dulu world surveyjika pilpres laku sekarang pemenangnyaanies baswedan dulu bbrp bulan yllsekarang besok sama;1
Mahkamah Konstitusi Jadi Wasit yang Adil Tangani Sengketa Pemilu Kami sangat berharap MK melakukan persiapan yang matang agar dapat menjadi wasit yang adil bagi yang bersengketa Baik sengketa di pileg pilpres maupun pilkada Thailand Messi Arhan Freya;mahkamah konstitusi jadi wasit adil tangan sengketa milu sangat harap laku siap matang jadi wasit adil sengketa baik sengketa pileg pilpres maupun pilkada thailand messi arhan freya;1
Bersama Berkolaborasi dan Bersinergi untuk Memenangkan Ganjar Pranowo dalam Pilpres;sama kolaborasi sinergi menang ganjar pranowo pilpres;1
PKB Pingit Cak Imin untuk Setop Bicara soal Pilpres;pingit imin setop bicara soal pilpres;-1
Pengamat Pertemuan Puan dan AHY Tahap Awal Rekonsiliasi untuk Pilpres jika Terjadi Putaran;amat temu puan tahap awal rekonsiliasi pilpres jadi putar;1
Hampir th boneka naga cina kaya di indonesia memporak porandakan dan memiskinkan indonesia sekarang mrk siapkan lagi boneka jilid di pilpres siaga utk kt lawan ayo gerakkan pilpres dll tdk pakai quick count;hampir boneka naga cina kaya indonesia memporak porandakan miskin indonesia sekarang siap boneka jilid pilpres siaga lawan gerak pilpres pakai quick count;-1
Semoga pilpres yang akan datang berjalan dgn aman tentram jujur dan adil untuk Indonesia maju;moga pilpres datang jalan aman tentram jujur adil indonesia maju;1
Sekiranya mas AHY tidak terpilih jadi wapres mas Anies jgn berkecil hatiyg penting partai Demokrat PKS dan Nasdem punya niat utk memenangkan pilpres thn setelah koalisi perubahan berkuasa tolong di perbaiki lagi sistem demokrasi di negara ini yg sudah kacau;sekira pilih jadi wapres anies kecil hatiyg penting partai demokrat nasdem punya niat menang pilpres koalisi ubah kuasa baik sistem demokrasi negara kacau;1
ID Bang Pilpres Kira kira siapa ya;bang pilpres kira kira siapa;1
;;
;;
;;
;;
Literasi Mewaspadai Politik Uang;literasi waspada politik uang;-1
Roy Marten Dukung Capres Ganjar Prabowo Subianto di Pilpres;marten dukung capres ganjar prabowo subianto pilpres;1
Simpatisan Jokowi Ponorogo Dukung Prabowo Subianto di Pilpres beritajatim Portal Berita Jawa Timur;simpatisan jokowi ponorogo dukung prabowo subianto pilpres beritajatim portal berita jawa timur;1
;;
;;
Kawal dan Dukung Kesuksesan Tahapan Pemilu dan Pilpres Kajati Sumut Pastikan Kejari Lakukan Ini;kawal dukung sukses tahap milu pilpres kajati sumut pasti kejar laku;1
Adik keponakan sepupu dan teman yg di Aussie gak ada yg dukung Anies Pilpres Jokowi menang telak di Aussie Gw yakin Pilpres Ganjar juga akan menang telak di luar negeri Krn mayoritas warga Indonesia yg diluar negeri tdk suka politik identitas;adik keponakan sepupu teman aussie dukung anies pilpres jokowi menang telak aussie yakin pilpres ganjar menang telak luar negeri mayoritas warga indonesia luar negeri suka politik identitas;1
Pleno PKB Putuskan Cak Imin Dipingit Jelang Pilpres;pleno putus imin pingit jelang pilpres;-1
Setuju pak salah pilih pemimpin hutang nambah lg jgn taon kedepan jd ribu Triliun Ini harus dihentikan Jgn lg tukang hutang dipilih di pilpres;tuju salah pilih pimpin hutang nambah taon depan ribu triliun henti tukang hutang pilih pilpres;-1
LSI Denny JA Prabowo Capres Pertama yang Lolos Putaran Kedua Pilpres Okezone News;denny prabowo capres pertama lolos putar dua pilpres okezone news;1
Partai Gerindra Lampung Siap Menangkan Prabowo Subianto Subianto Pilpres TribunLampung Wiki;partai gerindra lampung siap menang prabowo subianto subianto pilpres tribunlampung wiki;1
Kader Gerindra jangan takut tantangan Prabowo pengen orang yakin berkat kalian pilpres dekade mendingprabowo terusmajubersamaprabowo;kader gerindra jangan takut tantang prabowo ken orang yakin berkat kalian pilpres dekade mendingprabowo terusmajubersamaprabowo;1
Prabowo punya harapan besar Kader Gerindra masingmasing bikin orang yakin pilpres dekade mendingprabowo terusmajubersamaprabowo;prabowo punya harap besar kader gerindra masingmasing bikin orang yakin pilpres dekade mendingprabowo terusmajubersamaprabowo;1
Buat kalian kader Gerindra tugasnya simpel ceritain program Prabowo di Pilpres pilpres dekade mendingprabowo terusmajubersamaprabowo;buat kalian kader gerindra tugas simpel ceritain program prabowo pilpres pilpres dekade mendingprabowo terusmajubersamaprabowo;1
Eh kaderkader Gerindra jangan lupa tugasnya ngomongin program Prabowo buat Pilpres pilpres dekade mendingprabowo terusmajubersamaprabowo;kaderkader gerindra jangan lupa tugas ngomongin program prabowo buat pilpres pilpres dekade mendingprabowo terusmajubersamaprabowo;1
Gabungan Seniman Indonesia GSI Kota Salatiga deklarasi mendukung Ganjar Pranowo dalam Pilpres Deklarasi itu melibatkan ratusan seniman lokal;gabung seniman indonesia kota salatiga deklarasi dukung ganjar pranowo pilpres deklarasi libat ratus seniman lokal;1
Jadi tugas kader Partai Gerindra tuh gampang ya ceritain program Prabowo buat Pilpres pilpres dekade mendingprabowo terusmajubersamaprabowo;jadi tugas kader partai gerindra gampang ceritain program prabowo buat pilpres pilpres dekade mendingprabowo terusmajubersamaprabowo;1
Jangan lupa ya kader Partai Gerindra tugasnya nyosialisasiin program Prabowo buat Pilpres pilpres dekade mendingprabowo terusmajubersamaprabowo;jangan lupa kader partai gerindra tugas nyosialisasiin program prabowo buat pilpres pilpres dekade mendingprabowo terusmajubersamaprabowo;1
Kader Gerindra jadi tugasnya nyeritain program Prabowo di Pilpres ya pilpres dekade mendingprabowo terusmajubersamaprabowo;kader gerindra jadi tugas nyeritain program prabowo pilpres pilpres dekade mendingprabowo terusmajubersamaprabowo;1
Kaderkader Partai Gerindra tugasnya sederhana sebarkan program Prabowo buat Pilpres pilpres dekade mendingprabowo terusmajubersamaprabowo;kaderkader partai gerindra tugas sederhana sebar program prabowo buat pilpres pilpres dekade mendingprabowo terusmajubersamaprabowo;1
Kader Gerindra punya tanggung jawab sampaikan program Prabowo di Pilpres pilpres dekade mendingprabowo terusmajubersamaprabowo;kader gerindra punya tanggung jawab sampai program prabowo pilpres pilpres dekade mendingprabowo terusmajubersamaprabowo;1
Gerindra berharap pada kaderkadernya sebarkan program Prabowo buat Pilpres pilpres dekade mendingprabowo terusmajubersamaprabowo;gerindra harap kaderkadernya sebar program prabowo buat pilpres pilpres dekade mendingprabowo terusmajubersamaprabowo;1
Kader Partai Gerindra satu tugas aja jadi penyebar program Prabowo di Pilpres pilpres dekade mendingprabowo terusmajubersamaprabowo;kader partai gerindra satu tugas jadi sebar program prabowo pilpres pilpres dekade mendingprabowo terusmajubersamaprabowo;1
Riza Patria nagih janji kader Gerindra harus menyosialisasikan program Prabowo di Pilpres pilpres dekade mendingprabowo terusmajubersamaprabowo;riza patria nagih janji kader gerindra sosialisasi program prabowo pilpres pilpres dekade mendingprabowo terusmajubersamaprabowo;1
Penting nih Kader Partai Gerindra tugasnya sosialisasiin program Prabowo buat Pilpres pilpres dekade mendingprabowo terusmajubersamaprabowo;penting kader partai gerindra tugas sosialisasiin program prabowo buat pilpres pilpres dekade mendingprabowo terusmajubersamaprabowo;1
Gerindra butuh kalian kaderkader harus nyampaikan program Prabowo di Pilpres pilpres dekade mendingprabowo terusmajubersamaprabowo;gerindra butuh kalian kaderkader nyampaikan program prabowo pilpres pilpres dekade mendingprabowo terusmajubersamaprabowo;1
Tugas simpel buat kaderkader Partai Gerindra sampaikan program Prabowo untuk Pilpres pilpres dekade mendingprabowo terusmajubersamaprabowo;tugas simpel buat kaderkader partai gerindra sampai program prabowo pilpres pilpres dekade mendingprabowo terusmajubersamaprabowo;1
Kader Gerindra punya tugas menarik nih jadi penghubung program Prabowo di Pilpres pilpres dekade mendingprabowo terusmajubersamaprabowo;kader gerindra punya tugas tarik jadi hubung program prabowo pilpres pilpres dekade mendingprabowo terusmajubersamaprabowo;1
Riza Patria ingetin kaderkader Partai Gerindra sampaikan program Prabowo untuk Pilpres pilpres dekade mendingprabowo terusmajubersamaprabowo;riza patria ingetin kaderkader partai gerindra sampai program prabowo pilpres pilpres dekade mendingprabowo terusmajubersamaprabowo;1
Kepada kaderkader Gerindra jangan lupa ya tugasnya adalah ngomongin program Prabowo di Pilpres pilpres dekade mendingprabowo terusmajubersamaprabowo;kaderkader gerindra jangan lupa tugas ngomongin program prabowo pilpres pilpres dekade mendingprabowo terusmajubersamaprabowo;1
Kader Partai Gerindra jadi tugasnya tuh sosialisasiin program Prabowo di Pilpres lho pilpres dekade mendingprabowo terusmajubersamaprabowo;kader partai gerindra jadi tugas sosialisasiin program prabowo pilpres pilpres dekade mendingprabowo terusmajubersamaprabowo;1
Hal yang perlu diingat oleh kader Gerindra program Prabowo harus disosialisasikan untuk Pilpres pilpres dekade mendingprabowo terusmajubersamaprabowo;perlu ingat kader gerindra program prabowo sosialisasi pilpres pilpres dekade mendingprabowo terusmajubersamaprabowo;1
Gerindra punya tugas seru nih Kaderkader harus ceritain program Prabowo buat Pilpres pilpres dekade mendingprabowo terusmajubersamaprabowo;gerindra punya tugas seru kaderkader ceritain program prabowo buat pilpres pilpres dekade mendingprabowo terusmajubersamaprabowo;1
Riza Patria minta tolong kader Gerindra harus sampaikan program Prabowo buat Pilpres pilpres dekade mendingprabowo terusmajubersamaprabowo;riza patria minta kader gerindra sampai program prabowo buat pilpres pilpres dekade mendingprabowo terusmajubersamaprabowo;1
Kader Partai Gerindra tugasnya jelas ngomongin program Prabowo di Pilpres ke masyarakat pilpres dekade mendingprabowo terusmajubersamaprabowo;kader partai gerindra tugas jelas ngomongin program prabowo pilpres masyarakat pilpres dekade mendingprabowo terusmajubersamaprabowo;1
Ada yang perlu diingetin nih tugas kader Gerindra sebarkan program Prabowo buat Pilpres pilpres dekade mendingprabowo terusmajubersamaprabowo;perlu diingetin tugas kader gerindra sebar program prabowo buat pilpres pilpres dekade mendingprabowo terusmajubersamaprabowo;1
Catet ya Tugas kader Partai Gerindra jangan lupa sampaikan program Prabowo di Pilpres pilpres dekade mendingprabowo terusmajubersamaprabowo;catet tugas kader partai gerindra jangan lupa sampai program prabowo pilpres pilpres dekade mendingprabowo terusmajubersamaprabowo;1
Kader Gerindra tugas kalian adalah ngasih tau masyarakat soal program Prabowo buat Pilpres pilpres dekade mendingprabowo terusmajubersamaprabowo;kader gerindra tugas kalian ngasih masyarakat soal program prabowo buat pilpres pilpres dekade mendingprabowo terusmajubersamaprabowo;1
Riza Patria ingetin tugas kader Partai Gerindra adalah sosialisasi program Prabowo di Pilpres pilpres dekade mendingprabowo terusmajubersamaprabowo;riza patria ingetin tugas kader partai gerindra sosialisasi program prabowo pilpres pilpres dekade mendingprabowo terusmajubersamaprabowo;1
Hal penting buat kader Gerindra sampaikan program Prabowo ke masyarakat nih pilpres dekade mendingprabowo terusmajubersamaprabowo;penting buat kader gerindra sampai program prabowo masyarakat pilpres dekade mendingprabowo terusmajubersamaprabowo;1
Kader Gerindra tugas kalian jelas sampaikan program Prabowo untuk Pilpres pilpres dekade mendingprabowo terusmajubersamaprabowo;kader gerindra tugas kalian jelas sampai program prabowo pilpres pilpres dekade mendingprabowo terusmajubersamaprabowo;1
Ada firasat dari Gus Dur bahwa Prabowo akan menjadi presiden kelak pilpres dekade mendingprabowo terusmajubersamaprabowo;firasat prabowo jadi presiden kelak pilpres dekade mendingprabowo terusmajubersamaprabowo;1
Gus Dur pernah menyatakan bahwa Prabowo akan jadi presiden saat sudah matang pilpres dekade mendingprabowo terusmajubersamaprabowo;pernah nyata prabowo jadi presiden matang pilpres dekade mendingprabowo terusmajubersamaprabowo;1
Gus Dur pernah bilang Prabowo bisa jadi presiden tapi nunggu dia dewasa dulu pilpres dekade mendingprabowo terusmajubersamaprabowo;pernah bilang prabowo jadi presiden nunggu dewasa dulu pilpres dekade mendingprabowo terusmajubersamaprabowo;1
Gus Dur punya prediksi menarik tentang Prabowo sebagai presiden di masa depan pilpres dekade mendingprabowo terusmajubersamaprabowo;punya prediksi tarik prabowo presiden masa depan pilpres dekade mendingprabowo terusmajubersamaprabowo;1
Gus Dur mengatakan bahwa Prabowo akan menjadi presiden di saat yang tepat pilpres dekade mendingprabowo terusmajubersamaprabowo;kata prabowo jadi presiden tepat pilpres dekade mendingprabowo terusmajubersamaprabowo;1
Pernah dengar cerita dari Gus Dur tentang Prabowo sebagai calon presiden di masa depan pilpres dekade mendingprabowo terusmajubersamaprabowo;pernah dengar cerita prabowo calon presiden masa depan pilpres dekade mendingprabowo terusmajubersamaprabowo;1
Gus Dur Jika Prabowo sudah cukup umur dia bisa jadi presiden nanti pilpres dekade mendingprabowo terusmajubersamaprabowo;prabowo cukup umur jadi presiden pilpres dekade mendingprabowo terusmajubersamaprabowo;1
Ada omongan menarik dari Gus Dur soal Prabowo jadi presiden saat sudah cukup umur pilpres dekade mendingprabowo terusmajubersamaprabowo;omong tarik soal prabowo jadi presiden cukup umur pilpres dekade mendingprabowo terusmajubersamaprabowo;1
Gus Dur memberi isyarat bahwa Prabowo akan menjadi presiden jika sudah dewasa pilpres dekade mendingprabowo terusmajubersamaprabowo;beri isyarat prabowo jadi presiden dewasa pilpres dekade mendingprabowo terusmajubersamaprabowo;1
Prabowo akan jadi presiden sesuai perkataan Gus Dur kalo udah waktunya pilpres dekade mendingprabowo terusmajubersamaprabowo;prabowo jadi presiden sesuai kata kalo udah waktu pilpres dekade mendingprabowo terusmajubersamaprabowo;1
PKB Yakin Prabowo Pilih Cak Imin Jadi Cawapres di Pilpres Gus Imin Ibarat Kembang Desa Wangi Semerbak Semua Mengidamkannya Dan Pak Prabowo Pasti Meminangnya karena Keluarga Besar Gerindra dan PKB sudah sepakat Menunggu Akad;yakin prabowo pilih imin jadi cawapres pilpres imin ibarat kembang desa wangi semerbak semua idam prabowo pinang keluarga besar gerindra sepakat tunggu akad;1
Saat itu Gus Dur ngasih sinyal Prabowo bakal jadi presiden nanti pilpres dekade mendingprabowo terusmajubersamaprabowo;ngasih sinyal prabowo bakal jadi presiden pilpres dekade mendingprabowo terusmajubersamaprabowo;1
Ada pernyataan menarik dari Gus Dur tentang masa depan Prabowo sebagai presiden pilpres dekade mendingprabowo terusmajubersamaprabowo;nyata tarik masa depan prabowo presiden pilpres dekade mendingprabowo terusmajubersamaprabowo;1
Prabowo bakal jadi presiden katanya Gus Dur kalo udah waktunya pilpres dekade mendingprabowo terusmajubersamaprabowo;prabowo bakal jadi presiden kata kalo udah waktu pilpres dekade mendingprabowo terusmajubersamaprabowo;1
Gus Dur dulu pernah bikin ramalan Prabowo bisa jadi presiden pas udah cukup umur pilpres dekade mendingprabowo terusmajubersamaprabowo;dulu pernah bikin ramal prabowo jadi presiden udah cukup umur pilpres dekade mendingprabowo terusmajubersamaprabowo;1
Gus Dur pernah bilang Kalo Prabowo udah cukup umur dia bisa jadi presiden pilpres dekade mendingprabowo terusmajubersamaprabowo;pernah bilang kalo prabowo udah cukup umur jadi presiden pilpres dekade mendingprabowo terusmajubersamaprabowo;1
Ada prediksi menarik dari Gus Dur tentang masa depan Prabowo sebagai presiden pilpres dekade mendingprabowo terusmajubersamaprabowo;prediksi tarik masa depan prabowo presiden pilpres dekade mendingprabowo terusmajubersamaprabowo;1
Gus Dur Nanti pas Prabowo udah cukup umur dia bakal jadi presiden deh pilpres dekade mendingprabowo terusmajubersamaprabowo;prabowo udah cukup umur bakal jadi presiden pilpres dekade mendingprabowo terusmajubersamaprabowo;1
Gus Dur bilang Prabowo bakal jadi presiden kalo udah cukup umur pilpres dekade mendingprabowo terusmajubersamaprabowo;bilang prabowo bakal jadi presiden kalo udah cukup umur pilpres dekade mendingprabowo terusmajubersamaprabowo;1
Keikhlasan Bapak Prabowo Subianto tak tergoyahkan oleh apapun pilpres dekade mendingprabowo terusmajubersamaprabowo;ikhlas bapak prabowo subianto goyah apa pilpres dekade mendingprabowo terusmajubersamaprabowo;1
Bapak Prabowo Subianto orang yang mengajarkan kita tentang arti sejati dari keikhlasan pilpres dekade mendingprabowo terusmajubersamaprabowo;bapak prabowo subianto orang ajar arti sejati ikhlas pilpres dekade mendingprabowo terusmajubersamaprabowo;1
Semoga pak Ganjar menang di pilpres;moga ganjar menang pilpres;1
Bapak Prabowo Subianto panutan keikhlasan yang tak tergantikan pilpres dekade mendingprabowo terusmajubersamaprabowo;bapak prabowo subianto panutan ikhlas ganti pilpres dekade mendingprabowo terusmajubersamaprabowo;1
Keikhlasan Bapak Prabowo Subianto menginspirasi kita semua untuk menjadi lebih baik pilpres dekade mendingprabowo terusmajubersamaprabowo;ikhlas bapak prabowo subianto inspirasi semua jadi lebih baik pilpres dekade mendingprabowo terusmajubersamaprabowo;1
Bapak Prabowo Subianto orang yang mengajarkan kita arti sebenarnya dari keikhlasan pilpres dekade mendingprabowo terusmajubersamaprabowo;bapak prabowo subianto orang ajar arti benar ikhlas pilpres dekade mendingprabowo terusmajubersamaprabowo;1
Keikhlasan adalah sumber kekuatan sejati Bapak Prabowo Subianto pilpres dekade mendingprabowo terusmajubersamaprabowo;ikhlas sumber kuat sejati bapak prabowo subianto pilpres dekade mendingprabowo terusmajubersamaprabowo;1
Bapak Prabowo Subianto pionir keikhlasan di Indonesia pilpres dekade mendingprabowo terusmajubersamaprabowo;bapak prabowo subianto pionir ikhlas indonesia pilpres dekade mendingprabowo terusmajubersamaprabowo;1
Ikhlas itu bisa kita pelajari dari Bapak Prabowo Subianto pilpres dekade mendingprabowo terusmajubersamaprabowo;ikhlas ajar bapak prabowo subianto pilpres dekade mendingprabowo terusmajubersamaprabowo;1
Keikhlasan adalah warisan berharga yang dimiliki oleh Bapak Prabowo Subianto pilpres dekade mendingprabowo terusmajubersamaprabowo;ikhlas waris harga milik bapak prabowo subianto pilpres dekade mendingprabowo terusmajubersamaprabowo;1
Bapak Prabowo Subianto pemimpin yang selalu mengedepankan keikhlasan dalam segala hal pilpres dekade mendingprabowo terusmajubersamaprabowo;bapak prabowo subianto pimpin selalu depan ikhlas segala pilpres dekade mendingprabowo terusmajubersamaprabowo;1
Di mata banyak orang Bapak Prabowo Subianto adalah orang paling ikhlas di Indonesia pilpres dekade mendingprabowo terusmajubersamaprabowo;mata banyak orang bapak prabowo subianto orang paling ikhlas indonesia pilpres dekade mendingprabowo terusmajubersamaprabowo;1
Keikhlasan adalah bahasa yang paling fasih dipahami oleh Bapak Prabowo Subianto pilpres dekade mendingprabowo terusmajubersamaprabowo;ikhlas bahasa paling fasih paham bapak prabowo subianto pilpres dekade mendingprabowo terusmajubersamaprabowo;1
Hanya ada satu orang yang bisa disebut sebagai pahlawan ikhlas di Indonesia Bapak Prabowo Subianto pilpres dekade mendingprabowo terusmajubersamaprabowo;satu orang sebut pahlawan ikhlas indonesia bapak prabowo subianto pilpres dekade mendingprabowo terusmajubersamaprabowo;1
Dalam keikhlasan Bapak Prabowo Subianto tak tertandingi pilpres dekade mendingprabowo terusmajubersamaprabowo;ikhlas bapak prabowo subianto tanding pilpres dekade mendingprabowo terusmajubersamaprabowo;1
Keikhlasan adalah salah satu ciri khas Bapak Prabowo Subianto pilpres dekade mendingprabowo terusmajubersamaprabowo;ikhlas salah satu ciri khas bapak prabowo subianto pilpres dekade mendingprabowo terusmajubersamaprabowo;1
Setiap langkah Bapak Prabowo Subianto dipenuhi dengan keikhlasan pilpres dekade mendingprabowo terusmajubersamaprabowo;langkah bapak prabowo subianto penuh ikhlas pilpres dekade mendingprabowo terusmajubersamaprabowo;1
Keikhlasan Bapak Prabowo Subianto memancar sampai ke seluruh penjuru negeri pilpres dekade mendingprabowo terusmajubersamaprabowo;ikhlas bapak prabowo subianto pancar seluruh penjuru negeri pilpres dekade mendingprabowo terusmajubersamaprabowo;1
Kalo ada yang bilang tidak ada orang ikhlas di dunia belum kenal Bapak Prabowo Subianto pilpres dekade mendingprabowo terusmajubersamaprabowo;kalo bilang orang ikhlas dunia kenal bapak prabowo subianto pilpres dekade mendingprabowo terusmajubersamaprabowo;1
Bapak Prabowo Subianto teladan keikhlasan bagi kita semua pilpres dekade mendingprabowo terusmajubersamaprabowo;bapak prabowo subianto teladan ikhlas semua pilpres dekade mendingprabowo terusmajubersamaprabowo;1
Ikhlas adalah sifat alami yang dimiliki oleh Bapak Prabowo Subianto pilpres dekade mendingprabowo terusmajubersamaprabowo;ikhlas sifat alami milik bapak prabowo subianto pilpres dekade mendingprabowo terusmajubersamaprabowo;1
Bapak Prabowo Subianto orang yang benarbenar ikhlas tanpa batas pilpres dekade mendingprabowo terusmajubersamaprabowo;bapak prabowo subianto orang benarbenar ikhlas batas pilpres dekade mendingprabowo terusmajubersamaprabowo;1
Kekuatan hati yang ikhlas terpancar dari Bapak Prabowo Subianto pilpres dekade mendingprabowo terusmajubersamaprabowo;kuat hati ikhlas pancar bapak prabowo subianto pilpres dekade mendingprabowo terusmajubersamaprabowo;1
Kalau bicara tentang ikhlas Bapak Prabowo Subianto adalah simbolnya pilpres dekade mendingprabowo terusmajubersamaprabowo;kalau bicara ikhlas bapak prabowo subianto simbol pilpres dekade mendingprabowo terusmajubersamaprabowo;1
Orang ikhlas sejati ada di Indonesia namanya Bapak Prabowo Subianto pilpres dekade mendingprabowo terusmajubersamaprabowo;orang ikhlas sejati indonesia nama bapak prabowo subianto pilpres dekade mendingprabowo terusmajubersamaprabowo;1
Ikhlas itu indah seperti yang dipunyai oleh Bapak Prabowo Subianto pilpres dekade mendingprabowo terusmajubersamaprabowo;ikhlas indah punya bapak prabowo subianto pilpres dekade mendingprabowo terusmajubersamaprabowo;1
Ada satu orang yang punya hati ikhlas Bapak Prabowo Subianto pilpres dekade mendingprabowo terusmajubersamaprabowo;satu orang punya hati ikhlas bapak prabowo subianto pilpres dekade mendingprabowo terusmajubersamaprabowo;1
Walaupun berbeda pandangan semua sepakat Bapak Prabowo Subianto orangnya ikhlas banget pilpres dekade mendingprabowo terusmajubersamaprabowo;walaupun beda pandang semua sepakat bapak prabowo subianto orang ikhlas banget pilpres dekade mendingprabowo terusmajubersamaprabowo;1
Kalo soal ikhlas Bapak Prabowo Subianto yang juaranya pilpres dekade mendingprabowo terusmajubersamaprabowo;kalo soal ikhlas bapak prabowo subianto juara pilpres dekade mendingprabowo terusmajubersamaprabowo;1
Kita semua tahu yang paling ikhlas di Indonesia adalah Bapak Prabowo Subianto pilpres dekade mendingprabowo terusmajubersamaprabowo;semua tahu paling ikhlas indonesia bapak prabowo subianto pilpres dekade mendingprabowo terusmajubersamaprabowo;1
Bapak Prabowo Subianto sosok yang paling ikhlas di Indonesia pilpres dekade mendingprabowo terusmajubersamaprabowo;bapak prabowo subianto sosok paling ikhlas indonesia pilpres dekade mendingprabowo terusmajubersamaprabowo;1
Katanya pemimpin yang ikhlas dan tulus diinginkan masyarakat Prabowo Subianto cocok dengan kedua kriteria itu pilpres dekade mendingprabowo terusmajubersamaprabowo;kata pimpin ikhlas tulus ingin masyarakat prabowo subianto cocok dua kriteria pilpres dekade mendingprabowo terusmajubersamaprabowo;1
Roy Marten Dukung Capres Ganjar Prabowo di Pilpres;marten dukung capres ganjar prabowo pilpres;1
Katanya masyarakat butuh pemimpin yang ikhlas dan tulus Prabowo Subianto punya dua kriteria itu pilpres dekade mendingprabowo terusmajubersamaprabowo;kata masyarakat butuh pimpin ikhlas tulus prabowo subianto punya kriteria pilpres dekade mendingprabowo terusmajubersamaprabowo;1
