Tweet;tidy_text;sentimen
Menteri Pertahanan kita Prabowo Subianto punya semangat besar buat majuin industri pertahanan kita Semangat terus Pak pilpres dekade mendingprabowo terusmajubersamaprabowo;menteri tahan prabowo subianto punya semangat besar buat majuin industri tahan semangat terus pilpres dekade mendingprabowo terusmajubersamaprabowo;1
Prabowo Subianto jadi Menteri Pertahanan semoga bisa bawa perubahan positif buat industri pertahanan kita Sukses Pak pilpres dekade mendingprabowo terusmajubersamaprabowo;prabowo subianto jadi menteri tahan moga bawa ubah positif buat industri tahan sukses pilpres dekade mendingprabowo terusmajubersamaprabowo;1
Pleno PKB Putuskan Cak Imin Dipingit Jelang Pilpres;pleno putus imin pingit jelang pilpres;-1
Kelompok relawan bernamaSahabat Ganjarmendeklarasikan dukungannya kepadaGanjar Pranowountuk maju menjadi kandidat dalam Pilpres mendatang Deklarasi dukungan itu langsung dilakukan dari Daerah Istimewa Yogyakarta secara virtual Minggu;kelompok rawan bernamasahabat ganjarmendeklarasikan dukung kepadaganjar pranowountuk maju jadi kandidat pilpres datang deklarasi dukung langsung laku daerah istimewa yogyakarta virtual minggu;-1
Anto Kelompok Relawan Jokowi akan mendukung Prabowo di Pilpres Prabowo sudah menunjukkan loyalitas kepada Presiden Jokowi Prabowo mendukung semua kebijakan Jokowi Katakata Jokowi sulit dipercaya tapi Sikap politik Jokowi mudah terbaca;anto kelompok rawan jokowi dukung prabowo pilpres prabowo tunjuk loyalitas presiden jokowi prabowo dukung semua bijak jokowi katakata jokowi sulit percaya sikap politik jokowi mudah baca;1
Begini Ramalan Anies Jelang Pilpres;begini ramal anies jelang pilpres;1
Ribuan Sukarelawan Jokowi di Ponorogo Mantap Dukung Prabowo di Pilpres;ribu sukarelawan jokowi ponorogo mantap dukung prabowo pilpres;1
Kontrak Freeport Habis yg rasional ajalah Jgn sisipkan Freeport dlm agenda politik pilpres masa jabatan presiden paling lama thn;kontrak freeport habis rasional aja sisip freeport agenda politik pilpres masa jabat presiden paling lama;-1
Gabungan Seniman di Salatiga Resmi Dukung Ganjar di Pilpres;gabung seniman salatiga resmi dukung ganjar pilpres;1
Pilpres tdk jauh beda dgn pilpres yg jadi masalah adalah Rakyat tdk pernah Sadar bahwa Perangkat Pengaman Hirarki Penguasa siap mengabdi dgn jabatan yg diberi Pilpres Curang Jilid II bisa terjadi saya salut orang jawa taat aturan tdk seperti kami di Papua;pilpres jauh beda pilpres jadi masalah rakyat pernah sadar perangkat kam hirarki kuasa siap abdi jabat beri pilpres curang jilid jadi salut orang jawa taat atur papua;-1
Repost dari Kebakaran terjadi di Gang Lapo Sona Kelurahan Baringin Kota Sibolga Sumatera Utara;repost bakar jadi gang lapo sona lurah baringin kota sibolga sumatera utara;-1
Repost dari Bantuan gerobak gratis dari Partai Perindo berdampak langsung meningkatkan perekonomian warga;repost bantu gerobak gratis partai perindo dampak langsung tingkat ekonomi warga;1
Repost dari Kebakaran terjadi di Gang Lapo Sona Kelurahan Baringin Kota Sibolga Sumatera Utara;repost bakar jadi gang lapo sona lurah baringin kota sibolga sumatera utara;-1
Gerindra Minta Kader Gencarkan Serangan Darat Menangkan Prabowo Subianto di Pilpres;gerindra minta kader gencar serang darat menang prabowo subianto pilpres;1
 binAli dobos Shanty Pati apa mungkin banyak yg seperti gt jugakalau kalah pilpres;binal dobos shanty pati mungkin banyak jugakalau kalah pilpres;1
Mengenal sosok Siti Atikoh istri Ganjar Pranowo yang membuat publik penasaran menarik untuk dibahas Pasalnya sang suami yang merupakan Gubernur Jawa Tengah ini didapuk jadi Bakal Calon Presiden di pilpres yang diusung oleh PDI Perjuangan Seperti kata pepatah dibalik pria sukses ada wanita hebat dibelakangnya Demikian halnya dengan kesuksesan Ganjar Pranowo yang memimpin Jawa Tengah selama dua periode ini tentunya tak luput dari peran Siti Atikoh;kenal sosok siti atikoh istri ganjar pranowo buat publik penasaran tarik bahas pasal sang suami rupa gubernur jawa tengah didapuk jadi bakal calon presiden pilpres usung juang kata pepatah balik pria sukses wanita hebat belakang hal sukses ganjar pranowo pimpin jawa tengah lama periode tentu luput peran siti atikoh;1
Astagfirullah Miris Tenan Iki Cak Di Pingit DPP gak Boleh Omong Caprescawapresan Blm Lagi Isu Kardus Durian Digembokin Mulai Detik Ini Muhaimin Iskandar Dilarang Bicara soal Pilpres;astagfirullah miris tenan pingit omong caprescawapresan kardus durian digembokin mulai detik muhaimin iskandar larang bicara soal pilpres;-1
Simpatisan Jokowi di Ponorogo Pilih Dukung Prabowo Subianto pada Pilpres detikJatim;simpatisan jokowi ponorogo pilih dukung prabowo subianto pilpres detikjatim;1
Seru banget nih yang kemarin satu kereta bareng Pak Airlngga;seru banget kemarin satu kereta bareng airlngga;1
Rapat Pleno DPP PKB memutuskan bahwa Gus Muhaimin dilarang bicara soal Pilpres PKB;rapat pleno putus muhaimin larang bicara soal pilpres;-1
Simpatisan Jokowi di Ponorogo Pilih Dukung Prabowo pada Pilpres detikJatim;simpatisan jokowi ponorogo pilih dukung prabowo pilpres detikjatim;1
Sangat dramatikal banget ya pilpres tahun Ada aja kocaknya Ahlul mimpi lanjutkan jualan narasi mimpi kalian;sangat dramatikal banget pilpres tahun kocak ahlul mimpi lanjut jual narasi mimpi kalian;-1
Sejumlah orang Caleg DPR RI PKB Rapat Kordinasi Pemenangan Pileg amp Pilpres di Pemilu Jakarta Juni;jumlah orang caleg rapat kordinasi menang pileg pilpres milu jakarta juni;1
Menteri BUMN menjadi sosok yang terekam sbg cawapres terkuat di Pilpres Berdasarkan hasil survei terbaru dari lembaga IPO menteri andalan Presiden Jokowi ini menjadi cawaprespilihan utama masyarakat utk tiga capres potensial saat ini;menteri bumn jadi sosok rekam cawapres kuat pilpres dasar hasil survei baru lembaga menteri andal presiden jokowi jadi cawaprespilihan utama masyarakat tiga capres potensial;1
Ganjar lakukan konsolidasi pemenangan pilpres;ganjar laku konsolidasi menang pilpres;1
Ganjar pranowo sudah paling tepat menjadi presiden di Dukung ganjar Pilpres;ganjar pranowo paling tepat jadi presiden dukung ganjar pilpres;1
Dalam budaya Jawa pingit merupakan pembatasan aktivitas calon pengantin yang akan segera menikah Muhaimin yang diibaratkan sebagai calon pengantin pada Pilpres dipingit agar tidak bicara mengenai pilpres;budaya jawa pingit rupa batas aktivitas calon pengantin segera meni muhaimin ibarat calon pengantin pilpres pingit bicara kena pilpres;1
;;
;;
Walau Digoda PDIP Demokrat Tetap Solid Dukung Anies Baswedan di Pilpres;goda pdip demokrat tetap solid dukung anies baswedan pilpres;1
Jika Pilpres Dua Putaran Kemungkinan PDIPDemokrat Berkoalisi;pilpres putar mungkin pdipdemokrat koalisi;1
AS Saya sudah kenyang rekam jejak pilpres sejak zaman SBY dan yg paling Seru adalah pilpres dan pilpres jadi saya tidak akan salah pilih pemimpin di nanti pengalaman Seru bagi rakyat tentu menjadi memory yg sulit dilupakan;kenyang rekam jejak pilpres sejak zaman paling seru pilpres pilpres jadi salah pilih pimpin alam seru rakyat jadi memory sulit lupa;1
Sebagai Cawapres Erick Thohir dinilai mampu menambal kekurangan suara dari capres di pilpres Ia mampu menarik suara dari berbagai ceruk pemilih potensial;cawapres erick thohir nilai mampu tambal kurang suara capres pilpres mampu tarik suara bagai ceruk pilih potensial;1
PolriHarusNetral Persaingan Pilpres akan Keras Ganjar Punya Saran Elegan Tepis Politik Identitas lebih banyak detail;polriharusnetral saing pilpres keras ganjar punya saran elegan tepis politik identitas lebih banyak detail;1
Jika Pilpres Dua Putaran Kemungkinan PDIPDemokrat Berkoalisi;pilpres putar mungkin pdipdemokrat koalisi;1
Mengenal sosok Siti Atikoh yang membuat publik penasaran menarik untuk dibahas Pasalnya sang suami yang merupakan Gubernur Jateng ini didapuk jadi Bakal Capres di pilpres yang diusung oleh PDIP;kenal sosok siti atikoh buat publik penasaran tarik bahas pasal sang suami rupa gubernur jateng didapuk jadi bakal capres pilpres usung pdip;1
Hanya kaum goblok yg gak paham UU Calon presiden capres yang akan bertarung di Pilpres harus menguasai atau didukung setidaknya kursi milik partai politik di DPR RI Aturan itu tertuang dalam pasal UndangUndang Nomor Tahun tentang Pemilu UU Pemilu;kaum goblok paham calon presiden capres tarung pilpres kuasa dukung kursi milik partai politik atur tuang pasal undangundang nomor tahun milu milu;-1
Relawan optimis Ganjar kantongi persen suara di NTB pada Pilpres Arhan Asnawi Vietnam BAGUS BANGET Alvarez Garnacho Jorok Marselino Dosen Elkan SNBT De Paul Ernando Hujan Arab Saudi;rawan optimis ganjar kantong persen suara pilpres arhan asnawi vietnam bagus banget alvarez garnacho jorok marselino dosen elkan snbt paul ernando hujan arab saudi;1
Simpatisan Jokowi Ponorogo Dukung Prabowo di Pilpres beritajatim Portal Berita Jawa Timur;simpatisan jokowi ponorogo dukung prabowo pilpres beritajatim portal berita jawa timur;1
am Hampir th boneka naga cina kaya di indonesia memporak porandakan dan memiskinkan indonesia sekarang mrk siapkan lagi boneka jilid di pilpres siaga utk kt lawan ayo gerakkan pilpres dll tdk pakai quick count;hampir boneka naga cina kaya indonesia memporak porandakan miskin indonesia sekarang siap boneka jilid pilpres siaga lawan gerak pilpres pakai quick count;-1
Pilihanku saat ini beralih saat pilpres sya memilih berbagai alasan mengapa pindah pilihan itu semua RAHASIA UNTUK DPRDPRD SAYA NO MEMILIH;pilih alih pilpres pilih bagai alas pindah pilih semua rahasia dprdprd pilih;-1
Airlangga Hartarto memiliki modal bagus untuk maju di kontestasi Pilpres Pengamat menilai Ketua Umum Partai Golkar itu potensial menjadi calon presiden Capres;airlangga hartarto milik modal bagus maju kontestasi pilpres amat nilai ketua umum partai golkar potensial jadi calon presiden capres;1
Erick Thohir Bisa Gaet Suara Luar Jawa Duet dengan Ganjar Pranowo Dinilai Sangat Potensial Menteri BUMN merupakan pasangan potensial dan kuat di Pilpres duet GanjarErick merupakan duet yang bisa saling mengisi satu dengan lainnya;erick thohir gaet suara luar jawa duet ganjar pranowo nilai sangat potensial menteri bumn rupa pasang potensial kuat pilpres duet ganjarerick rupa duet saling isi satu lain;1
Namun tidak menutup kemungkinan pertemuan AHYPuan dapat menjadi modal manuver politik untuk menghadapi putaran kedua di Pilpres;tutup mungkin temu ahypuan jadi modal manuver politik hadap putar dua pilpres;-1
LSI Denny JA Airlangga Bisa Jadi Cawapres Prabowo atau Buat Poros Keempat di Pilpres Republika;denny airlangga jadi cawapres prabowo buat poros empat pilpres republika;1
;;
chotimah AbdillahToha Pilpres Suara pakde ps Diyakini thn suara pakde suara GP Lahelu ribut deh ama suara ps yg itu Terus elu mau menang pula Ngimpi lu emang ori;chotimah abdillahtoha pilpres suara pakde yakin suara pakde suara lahelu ribut suara terus menang ngimpi emang;-1
PKB menggelar rapat pleno pemenangan pemilu Hasilnya Cak Imin dipingit dan tidak diperkenankan berbicara mengenai pilpres;gelar rapat pleno menang milu hasil imin pingit kenan bicara kena pilpres;-1
Simpatisan Jokowi Ponorogo Dukung Prabowo di Pilpres Simpatisan Joko Widodo Jokowi di Kabupaten Ponorogo mendeklarasikan diri mendukung Ketua Umum Ketum Partai Gerindra via;simpatisan jokowi ponorogo dukung prabowo pilpres simpatisan joko widodo jokowi kabupaten ponorogo deklarasi diri dukung ketua umum tum partai gerindra;1
Ngapain kami milih Bacapres yang hobi nonton film BOKEP Masyarakat NTB siap All Out Menangkan Insya allah Minimal untuk Daerah NTB suara di Pilpres untuk Pak Anies;ngapain milih bacapres hobi nonton film bokep masyarakat siap menang insya allah minimal daerah suara pilpres anies;-1
Puan Maharani sosok yang terus menginspirasi masyarakat untuk merangkul perbedaan dan menyatukan visi dan misi dalam membangun bangsa yang lebih baik Fav MLBB Event;puan maharani sosok terus inspirasi masyarakat rangkul beda satu visi misi bangun bangsa lebih baik mlbb event;1
Mas Ganjar meminta masyarakat berhatihati karena peredaran informasi saat ini bisa terjadi sangat cepat Setiap orang diminta benarbenar menahan diri demi menjaga situasi menjelang Pemilu dan Pilpres tetap kondusif Salam PancasilaMerdeka;ganjar minta masyarakat berhatihati edar informasi jadi sangat cepat orang minta benarbenar tahan diri jaga situasi jelang milu pilpres tetap kondusif salam pancasilamerdeka;1
Tadi sempat ada diskusi yang lumayan menghangat soal Pilpres Rapat pleno DPP akhirnya memutuskan agar Gus Muhaimin Iskandar mulai hari ini dipingit kalau bahasa Jawa dipingit tidak boleh berbicara soal Pilpres cukup nanti mendelegasikan kepada pengurus DPP Gus Yusuf;tadi sempat diskusi lumayan hangat soal pilpres rapat pleno akhir putus muhaimin iskandar mulai hari pingit kalau bahasa jawa pingit bicara soal pilpres cukup delegasi urus yusuf;1
Lanjutkan kerja politik rebut hati rakyat;lanjut kerja politik rebut hati rakyat;-1
TV Anies tidak ada dalam daftar di Otakku Indonesia BUTUH FIGUR SELAIN anies yg mampu berpikir amp mengeksekusi BUKAN HANYA MAINAN KATA agar Indonesia berkembang amp maju aku CORET anies dalam Pilpres;anies daftar otak indonesia butuh figur anies mampu pikir eksekusi bukan main kata indonesia kembang maju coret anies pilpres;-1
Partai Golkar masih belum bisa memastikan apakah ketua umumnya Airlangga Hartarto akan maju dengan Prabowo Subianto di Pilpres Namun Golkar masih terus intensif menjalin komunikasi dengan semua pihak terutapan Koalisi Kebangkitan Indonesia Raya;partai golkar pasti ketua umum airlangga hartarto maju prabowo subianto pilpres golkar terus intensif jalin komunikasi semua pihak terutapan koalisi bangkit indonesia raya;1
Ganjaar sebut posisi istimewa PPP Saat kerja sama daalam pilpres;ganjaar sebut posisi istimewa kerja sama daalam pilpres;1
Bismillah semoga Allah meridhoi pak Anoes Baswedan menang dalam pilpres Aamiin yaa mujibassailin;bismillah moga allah meridhoi anoes baswedan menang pilpres aamiin mujibassailin;1
Suatu saat kau akan merasakan apa yg kau bilang intoleran itu sabarlah menunggu itu pasti datang setelah si anis terbuang di pilpres Kadrun akan menyerangmu krn mereka berpikir kaulah yg membuat si anis kalah;suatu rasa bilang intoleran sabar tunggu datang anis buang pilpres kadrun serang pikir kau buat anis kalah;-1
Pendeta se Sidoarjo Kepincut Dan RameRame Dukung Prabowo Maju Pilpres Ratusan pendeta gereja se Sidoarjo dan sekitarnya kepincut dan menyatakan dukungan agar ketum Partai Gerindra Prabowo Subianto untuk maju di Pilpres mendatang Dukungan tersebut disampaikan ketika para pendeta gereja tersebut menemui politisi Gerindra Benyamin Kristianto di Sidoarjo selasa November Menurut pendeta Sihombing mengatakan ketokohan Prabowo Subianto secara nasional paling menonjol diantara banyak nama yang dihembuskan untuk maju capres pada Karena didapatkan melalui pengalamanan yang dilakukan dalam puluhan tahun yang lalu Sosok yang sangat loyal dan tegas tidak terdengar maupun terlihat seorang Prabowo bersebelahan dengan Presiden kata Sihombing Prabowo Subiantokata Sihombing juga bisa disebut sebagai tokoh pluralisme di Indonesia karena mudah diterima disemua agama di IndonesiaSelalu mengedepankan kebhinekaan dan menjunjung tinggi nilainilai kemanusiaan yang menjadi salah satu modal utama para pendeta di Sidoarjo ikrar untuk mendukung Prabowo Subianto menjadi presiden mendatangterangnya Senada dengan pendeta Sihombing pendeta lainnya pendeta Roha mengatakan sosok Prabowo Subianto juga dikenal lekat dengan masyarakat menengahbawah Semua hasil survei menunjukkan kalau masyarakat menengah kebawah sangat mengenal sosok Prabowo Subianto Tak hanya hasil survei hasil kenyataannya setiap turun ke bawah sambutan masyarakat selalu meluas jika Prabowo Subianto turun ke masyarakatjelasnya Sedangkan politisi Gerindra Benyamin Kristianto mengatakan pihaknya menyambut baik atas dukungan para pendeta tersebut untuk Prabowo Subianto sebagai calon presiden Menurut anggota DPRD Jawa Timur Prabowo Subianto adalah tokoh nasional yang layak didukung karena sosok yang nasionalis dan pluralisme Bukti kalau pak Prabowo tokoh nasional dan pluralisme adalah selalu menekankan kepada kami selaku kader Partai Gerindra untuk peduli terhadap rakyat di bawah Minta kepada kami untuk terus turun kebawah melakukan kegiatan sosial mulai disektor pemenuhan kesehatan maupun lainnya tanpa membedabedakan agama suku dan lainnyajelas pria yang juga seorang dokter ini Benyamin berharap dengan dukungan dari para pendeta tersebut diharapkan akan berdampak dari dukungan tokohtokoh agama lainnya untuk Prabowo Subianto Tak hanya kristen dan Islam saja tokoh agama lainnya mari bersamasama bersinergi untuk memenangkan Prabowo Subianto di Pilpres mendatang;pendeta sidoarjo kepincut ramerame dukung prabowo maju pilpres ratus pendeta gereja sidoarjo sekitar kepincut nyata dukung tum partai gerindra prabowo subianto maju pilpres datang dukung sebut sampai pendeta gereja sebut temu politis gerindra benyamin kristianto sidoarjo selasa november pendeta sihombing kata tokoh prabowo subianto nasional paling tonjol antara banyak nama hembus maju capres dapat lalu pengalamanan laku puluh tahun lalu sosok sangat loyal tegas dengar maupun lihat orang prabowo bahan presiden kata sihombing prabowo subiantokata sihombing sebut tokoh pluralisme indonesia mudah terima semua agama indonesiaselalu depan kebhinekaan junjung tinggi nilainilai manusia jadi salah satu modal utama pendeta sidoarjo ikrar dukung prabowo subianto jadi presiden mendatangterangnya nada pendeta sihombing pendeta lain pendeta roha kata sosok prabowo subianto kenal lekat masyarakat menengahbawah semua hasil survei tunjuk kalau masyarakat tengah bawah sangat kenal sosok prabowo subianto hasil survei hasil nyata turun bawah sambut masyarakat selalu luas prabowo subianto turun masyarakatjelasnya politis gerindra benyamin kristianto kata pihak sambut baik atas dukung pendeta sebut prabowo subianto calon presiden anggota dprd jawa timur prabowo subianto tokoh nasional layak dukung sosok nasionalis pluralisme bukti kalau prabowo tokoh nasional pluralisme selalu tekan selaku kader partai gerindra peduli rakyat bawah minta terus turun bawah laku giat sosial mulai sektor penuh sehat maupun lain membedabedakan agama suku lainnyajelas pria orang dokter benyamin harap dukung pendeta sebut harap dampak dukung tokohtokoh agama lain prabowo subianto kristen islam tokoh agama lain bersamasama sinergi menang prabowo subianto pilpres datang;1
Projo Sulsel Dukung Prabowo Subianto di Pilpres Ini Alasannya Tribun Toraja;projo sulsel dukung prabowo subianto pilpres alas tribun toraja;1
Muhaimin Iskandar Dipingit PKB Tak Boleh Bicara Pilpres;muhaimin iskandar pingit bicara pilpres;-1
Partai Harus Berbenah Usai Putusan MK Soal Sistem Pemilu;partai benah usai putus soal sistem milu;1
BRIM Rekomendasikan Pemilu Proposional Terbuka;brim rekomendasi milu proposional buka;1
PPP Siap Pecat Kader Pelaku Politik Uang;siap pecat kader laku politik uang;1
BRIN Rekomendasikan Sistem Penyelenggaraan Pemilu Proposional Terbuka;brin rekomendasi sistem selenggara milu proposional buka;1
Partai Politik Bertanggung Jawab Hapuskan Politik Uang;partai politik tanggung jawab hapus politik uang;1
Tadi sempat ada diskusi yang lumayan menghangat soal Pilpres Rapat pleno DPP akhirnya memutuskan agar Gus Muhaimin Iskandar mulai hari ini dipingit kalau bahasa Jawa dipingit tidak boleh berbicara soal Pilpres cukup nanti mendelegasikan kepada pengurus DPP Gus Yusuf;tadi sempat diskusi lumayan hangat soal pilpres rapat pleno akhir putus muhaimin iskandar mulai hari pingit kalau bahasa jawa pingit bicara soal pilpres cukup delegasi urus yusuf;-1
silent Awas rezim ulangi curang pilpres mrk merasa tdk akan ada yg berani melawan Awas KPU curang lewat quick count yg di setting utk menangkan capres rezim Konflik pilpres jangan di bawa ke MKtuntaskan di KPU dngn Bawaslu jk ke MK mrk menang;silent awas rezim ulang curang pilpres rasa berani lawan awas curang lewat quick count setting menang capres rezim konflik pilpres jangan bawa mktuntaskan dngn bawaslu menang;-1
yg sudah dideklarasikan baru kandidat yaitu pak Anies pak Prabowo amp pak Ganjar Jika ada lg Bacapres yg dideklarasikan maka opsinya semakin banyak amp bervariasi bagi rakyat;deklarasi baru kandidat anies prabowo ganjar bacapres deklarasi opsi makin banyak variasi rakyat;1
BRIN rekomendasikan sistem penyelenggaraan Pemilu proporsional terbuka;brin rekomendasi sistem selenggara milu proporsional buka;1
;;
;;
;;
;;
;;
Gue rasa buat Pilpres ga perlu ribut atau gontokan Toh ini cuma pertandingan friendly match Siapapun yg kalah bakalan tetap dapat jatah di kabinet Sebaiknya ketimbang gontokan ada baiknya mempersiapkan diri sebagai fungsi kontrol eksekutif amp legislatif;rasa buat pilpres perlu ribut gontok cuma tanding friendly match siapa kalah bakal tetap jatah kabinet baik ketimbang gontok baik siap diri fungsi kontrol eksekutif legislatif;-1
ali Bhs yg lbh santunya seharusnya pilpres amp adalah dia yg terpilihmenang tp sayang sekali faktanya tdk demikian jd insyaAllah tahun nya yg muda yg jd pemimpin negri ini aamiin;santunya pilpres terpilihmenang sayang sekali fakta insyaallah tahun muda pimpin negri aamiin;1
Pemimpin masa depan itu adalah dia yang selalu berinovasi Bukan sekedar haha hihi;pimpin masa depan selalu inovasi bukan dar haha hihi;1
Waspada politikus nakal beredar di lingkungan kita;waspada politikus nakal edar lingkung;1
;;
Dan lihat utk pilpres Ini mereka semua di belakang siapa;lihat pilpres semua belakang siapa;-1
Politik uang jadi cara instan politisi nakal untuk berkuasa;politik uang jadi cara instan politis nakal kuasa;-1
Waspada politikus nakal beredar di lingkungan anda;waspada politikus nakal edar lingkung;-1
Info  Prabowo amp Airlangga di Pilpres;info prabowo airlangga pilpres;1
Ganjar sebut posisi istimewa PPP saat kerjasama dalam pilpres;ganjar sebut posisi istimewa kerjasama pilpres;1
Panel Survei Indonesia Sebut Persen Pemilih Jokowi Memilih Airlangga Hartarto di Pilpres;panel survei indonesia sebut persen pilih jokowi pilih airlangga hartarto pilpres;1
Di Pilpres nanti Presiden Joko Widodo seharusnya  Mendukung Ganjar Pranowo Karena Sama Petugas Partai  Mendukung Prabowo Subianto Karena Ketua Umum Partai  Seharusnya Netral Biarkan Rakyat Menentukan;pilpres presiden joko widodo dukung ganjar pranowo sama tugas partai dukung prabowo subianto ketua umum partai netral biar rakyat tentu;1
AnakKolong Satu hal yang paling saya tunggu setelah Pilpres adlh sikap Prabowo jika dia kalah Kalau dia menang jelas gada masalah Tp jika Prabowo kalah lg akankah dia berbesar hati seperti seharusnya atau dia kembali ke watak asli di;anakkolong satu paling tunggu pilpres adlh sikap prabowo kalah kalau menang jelas gada masalah prabowo kalah akan besar hati watak asli;1
Anies Baswedan dan AHY berpotensi jadi pasangan di Pilpres;anies baswedan potensi jadi pasang pilpres;1
Menuju Pilpres Anies kantongi Cawapres AHY terkuat;tuju pilpres anies kantong cawapres kuat;1
Persatuan Indonesia adalah harga matiMbak Puan Maharani Selalu Mengajak untuk terus menyatukan Bangsa vs Now;satu indonesia harga matimbak puan maharani selalu ajak terus satu bangsa;1
projo mendapat MANDAT setia dan garis keras terhadap Info  untuk memberikan dukungan kepada dan untuk berpasangan pada pilpres mendatang ketum tersebut diperebutkan oleh beberapa partai;projo dapat mandat setia garis keras info beri dukung pasang pilpres datang tum sebut rebut beberapa partai;1
Repost dari DPD Partai Perindo Solo membagikan gerobak gratis bagi pedagang kecil di Solo Jawa Tengah;repost partai perindo solo bagi gerobak gratis dagang kecil solo jawa tengah;1
Makanyaaaaa Gimana caranya gagal nyapres dengan cawe cawe di pilpres paham bong;makanyaaaaa gimana cara gagal nyapres cawe cawe pilpres paham bong;-1
Kedekatan antara pranowo dan semoga akan tetap terjaga guna menggerakkan dan mewujudkan kemajuan negara yang lebih baik bagi keberlanjutan masa depan;dekat pranowo moga tetap jaga gerak wujud maju negara lebih baik lanjut masa depan;1
Pasangan AniesAHY kandidat paling berpotensi menangkan Pilpres;pasang aniesahy kandidat paling potensi menang pilpres;1
Dorong perbaikan partai politik;dorong baik partai politik;1
Pemilu tetap terbuka;milu tetap buka;1
;;
Sistem penyelenggaraan pemilu terbuka;sistem selenggara milu buka;1
Partai harus berbenah;partai benah;1
Pilpres Pengamat Sebut Sandiaga Uno Sulit Jadi Cawapres Ganjar Pranowo Semua Tergantung Jokowi;pilpres amat sebut sandiaga sulit jadi cawapres ganjar pranowo semua gantung jokowi;-1
Gus Muhaimin dan PKB kami mendukung Gagasan luar BiasaMU dan menghatarkan untuk jadi calon pilpres;muhaimin dukung gagas luar biasa menghatarkan jadi calon pilpres;1
;;
;;
Pengamat Jelang Pilpres AS Makin Semangat Terlibat dengan China;amat jelang pilpres makin semangat libat china;1
Anda ingin hidup aman nyaman dan tenteram di Indonesia Bisa tapi ada syaratnya doong Salah satu syarat utamanya adalah Pilpres JANGAN MEMILIH ANIES BASWEDAN Titik Gapake koma;hidup aman nyaman tenteram indonesia syarat doong salah satu syarat utama pilpres jangan pilih anies baswedan titik gapake koma;1
;;
Pilpres kita memerlukan pemimpin yg berpikir out of the boxbukan out of date;pilpres perlu pimpin pikir boxbukan date;1
Cukup tau aja kan siapa di belakang siapa di pilpres nanti;cukup siapa belakang siapa pilpres;-1
Pengamat Baca Arah Koalisi PDIP dan Demokrat di Pilpres Usai Puan AHY Bertemu;amat baca arah koalisi pdip demokrat pilpres usai puan temu;-1
Jelang pemilu DPD PDI Perjuangan NTB menggelar konsolidasi pemenangan pilpres Chris Martin Hujan Wasit;jelang milu juang gelar konsolidasi menang pilpres chris martin hujan wasit;1
Ganjar Pranowo sebut posisi istimewa PPP saat kerja sama dalam koalisi pilpres;ganjar pranowo sebut posisi istimewa kerja sama koalisi pilpres;1
Sudah ditebak ga bakalan bisa jd presiden di pilpres;tebak bakal presiden pilpres;1
